{
  "$schema": "http://json-schema.org/draft-04/schema#",
  "title": "Translation Schema",
  "type": "object",
  "additionalProperties": false,
  "properties": {
    "DialogueDictionary": {
      "type": "object",
      "description": "Translation table for dialogue and Nomai text.",
      "additionalProperties": {
        "type": "string"
      }
    },
    "ShipLogDictionary": {
      "type": "object",
      "description": "Translation table for Ship Log (entries, facts, etc).",
      "additionalProperties": {
        "type": "string"
      }
    },
    "UIDictionary": {
      "type": "object",
      "description": "Translation table for UI elements e.g., item names, planet names, HUD notification. Basically anything that is not dialogue, Nomai text, or ship logs.",
      "additionalProperties": {
        "type": "string"
      }
    },
    "OtherDictionary": {
      "type": "object",
      "description": "Translation table for other text, will be taken verbatim without correcting CDATA. This is meant only for use in your custom code with the GetTranslationForOtherText API method.",
      "additionalProperties": {
        "type": "string"
      }
    },
    "AchievementTranslations": {
      "type": "object",
      "description": "Translation table for achievements. The key is the unique ID of the achievement",
      "additionalProperties": {
        "$ref": "#/definitions/AchievementTranslationInfo"
      }
    },
    "$schema": {
      "type": "string",
      "description": "The schema to validate with"
    }
  },
  "definitions": {
    "AchievementTranslationInfo": {
      "type": "object",
      "additionalProperties": false,
      "properties": {
        "Name": {
          "type": "string",
          "description": "The name of the achievement."
        },
        "Description": {
          "type": "string",
          "description": "The short description for this achievement. (If showDescriptionNotAchieved is true in the achievement info this is shown AFTER the player gets the achievement)"
        },
        "DescriptionNotAchieved": {
          "type": "string",
          "description": "The short description for this achievement shown BEFORE the player gets the achievement. (Only if showDescriptionNotAchieved is true in the achievement info)"
        }
      }
    }
  },
  "$docs": {
    "title": "Translation Schema",
    "description": "Schema for a translation file in New Horizons"
  }
}